İsim,Kapalı Formül,Yoğunluk (g/cm³),pH,Kaynama Noktası (°C),Suda Çözünürlük (%),Max Su Oranı (%),Uyumlu Solventler,Kullanım Alanları,Toksisite / Güvenlik
Metilen Klorür,CH2Cl2,1.33,,39.8,1.3,,"Toluen, Aseton","Boya sökücü, metal yüzey temizleme","Toksik, kanser şüpheli"
Trikloroetilen,C2HCl3,1.46,,87.2,0.1,,"IPA, Toluen",Endüstriyel metal temizleyici,"Nörotoksik, tahriş edici"
Perkloroetilen,C2Cl4,1.62,,121.0,0.015,,Kloroform,"Kuru temizleme, metal yüzey hazırlama","Kanser şüpheli, çevresel risk"
N-Metil-2-pirolidon (NMP),C5H9NO,1.03,7.5,202.0,100.0,Sınırsız,"Su, DMSO","Metal dekapan, kaplama çözücü","Üreme toksini, dikkatli kullanım"
IPA (İzopropil Alkol),C3H8O,0.785,7.0,82.5,100.0,Sınırsız,"Su, Aseton","Yüzey temizliği, elektronik temizlik","Düşük toksik, yanıcı"
Beyaz Ruh (White Spirit),Karışım,0.78,,150.0,0.01,,"Toluen, Heptan","Boyadan arındırma, metal temizliği","Solunum tahrişi, hafif toksik"
Dietilen Glikol Dietil Eter (DEGDEE),C8H18O3,0.942,,202.0,100.0,Sınırsız,"Aseton, Etanol","Yağ alma, endüstriyel yüzey temizliği","Düşük toksik, yavaş buharlaşır"
